<?xml version="1.0" encoding="UTF-8"?>
<hrmanifest xmlns:xsi="http://www.w3.org/2001/XMLSchema-instance"
   xsi:schemaLocation="https://github.com/rSmart/ce-tech-docs/tree/master/v1_0
                       https://raw.github.com/rSmart/ce-tech-docs/master/v1_0/hrmanifest.xsd"
                xmlns="https://github.com/rSmart/ce-tech-docs/tree/master/v1_0"
   schemaVersion="1.0"
   reportDate="2013-05-20T13:03:00"
   recordCount="1">
  <records>
    <record principalId="0001" principalName="jdoe">
      <affiliations>
        <affiliation affiliationType="FCLTY"
          campus="MN"
          employeeStatus="A"
          employeeType="P"
          baseSalaryAmount="50180"
          primaryDepartment="MATH"
          employeeId="092001234"
          primaryEmployment="true"
          default="true"
          active="true"
        />
      </affiliations>
      <addresses>
        <address addressType="HM"
          addressLine1="1234 E. Main St."
          addressLine2="Apt. 8C"
          city="Minneapolis"
          stateOrProvince="MN"
          postalCode="34567"
          country="US"
          default="true"
          active="true" />
      </addresses>
      <names>
        <name nameCode="PRM"
          prefix="Mr"
          firstName="Jonathon"
          lastName="Doe"
          default="true"
          active="true" />
      </names>
      <phones>
        <phone phoneType="WRK"
          phoneNumber="204-391-1101"
          country="US"
          default="true"
          active="true" />
        <phone phoneType="HM"
          phoneNumber="204-718-3221"
          country="US"
          active="true" />
      </phones>
      <emails>
        <email emailType="WRK"
          emailAddress="jdoe@university.edu"
          default="true"
          active="true" />
      </emails>
      <kcExtendedAttributes county="Maricopa"
        ageByFiscalYear="52"
        race="CAUCASIAN"
        educationLevel="PHD"
        degree="Doctor of Psychology"
        major="MATHEMATICS"
        handicapped="true"
        handicapType="TODO Need a better handicapType example"
        veteran="true"
        veteranType="A"
        visa="true"
        visaCode="TODO need a better visaCode example"
        visaType="TODO need a better visaType example"
        visaRenewalDate="2013-12-25"
        officeLocation="503 Carter Hall"
        secondaryOfficeLocation="88 Regan Hall"
        school="MATH"
        yearGraduated="1983"
        directoryDepartment="MATH"
        directoryTitle="Master of the Universe"
        primaryTitle="Leader of the Evil Horde"
        vacationAccrual="true"
        idProvided="John_Doe"
        idVerified="John_Doe_Verified"
        multiCampusPrincipalId="0002"
        multiCampusPrincipalName="jdoe2"
        onSabbatical="true"
        citizenshipType="1"
        salaryAnniversaryDate="2010-01-01"/>
      <degrees>
        <degree degree="PhD"
          degreeType="GRAD"
          graduationYear="1983"
          fieldOfStudy="Mathematics"
          specialization="non-linear algebra"
          school="Texas A&amp;M University"
          schoolId="1234"
          schoolIdCode="UMN" />
      </degrees>
      <appointments>
        <appointment unit="MATH"
          jobCode="0010"
          appointmentType="APP"
          salary="50180"
          startDate="2010-01-01"
          jobTitle="Professor"
          preferedJobTitle="Professor"/>
      </appointments>
    </record>
  </records>
</hrmanifest>