<?xml version="1.0" encoding="UTF-8"?>
<hrmanifest xmlns:xsi="http://www.w3.org/2001/XMLSchema-instance"
   xsi:schemaLocation="https://github.com/KualiCo/ce-tech-docs/tree/master/v2_1
                       https://raw.github.com/KualiCo/ce-tech-docs/master/v2_1/hrmanifest.xsd"
                xmlns="https://github.com/KualiCo/ce-tech-docs/tree/master/v2_1"
   schemaVersion="2.1"
   reportDate="2013-05-20T13:03:00"
   recordCount="1">
  <records>
    <record principalId="1234567890" principalName="jdoe">
      <affiliations>
        <affiliation affiliationType="FCLTY"
          campus="MN"
          default="true"
          active="true">
          <employment employeeStatus="A"
            employeeType="P"
            baseSalaryAmount="50180"
            primaryDepartment="MATH"
            employeeId="092001234"
            primaryEmployment="true"/>
        </affiliation>
      </affiliations>
      <addresses>
        <address addressTypeCode="HM"
          addressLine1="1234 E. Main St."
          addressLine2="Apt. 8C"
          city="Minneapolis"
          stateOrProvince="MN"
          postalCode="34567"
          country="US"
          default="true"
          active="true" />
      </addresses>
      <names>
        <name nameCode="PRM"
          prefix="Mr"
          firstName="Jonathon"
          middleName="R"
          lastName="Doe"
          default="true"
          active="true" />
      </names>
      <phones>
        <phone phoneType="WRK"
          phoneNumber="204-391-1101"
          country="US"
          default="true"
          active="true" />
        <phone phoneType="HM"
          phoneNumber="204-718-3221"
          country="US"
          active="true" />
      </phones>
      <emails>
        <email emailType="WRK"
          emailAddress="jdoe@university.email"
          default="true"
          active="true" />
      </emails>
      <kcExtendedAttributes county="Maricopa"
        ageByFiscalYear="52"
        race="CAUCASIAN"
        educationLevel="PHD"
        degree="M.Sc."
        major="MATHEMATICS"
        handicapped="true"
        handicapType="Olfactory"
        veteran="true"
        veteranType="A"
        visa="true"
        visaCode="TBD"
        visaType="TBD"
        visaRenewalDate="2013-12-25"
        officeLocation="503 Carter Hall"
        secondaryOfficeLocation="88 Regan Hall"
        school="MATH"
        yearGraduated="1983"
        directoryDepartment="MATH"
        directoryTitle="Master of the Universe"
        primaryTitle="Leader of the Evil Horde"
        vacationAccrual="true"
        idProvided="John_Doe"
        idVerified="John_Doe_Verified"
        multiCampusPrincipalId="0002"
        multiCampusPrincipalName="jdoe2"
        onSabbatical="true"
        citizenshipType="1"
        salaryAnniversaryDate="2010-01-01"/>
      <degrees>
        <degree degree="PhD"
          degreeCode="DD"
          graduationYear="1983"
          fieldOfStudy="Mathematics"
          specialization="non-linear algebra"
          school="Texas A&amp;M University"
          schoolId="1234"
          schoolIdCode="UMN" />
      </degrees>
      <appointments>
        <appointment unitNumber="SECED"
          jobCode="0010"
          appointmentType="1"
          salary="50180"
          startDate="2010-01-01"
          jobTitle="Professor"
          preferedJobTitle="Professor"/>
      </appointments>
    </record>
  </records>
</hrmanifest>
